"DESCRIPTION","DURATION IN MS","NAME","PARENT SUITE","START TIME","STATUS","STOP TIME","SUB SUITE","SUITE","TEST CLASS","TEST METHOD"
"","288","should display the main heading","mobile-chrome","Mon Feb 16 10:58:10 UTC 2026","passed","Mon Feb 16 10:58:10 UTC 2026","Home page","smoke/home.spec.ts","",""
"","627","should display correct table columns","mobile-chrome","Mon Feb 16 10:54:24 UTC 2026","passed","Mon Feb 16 10:54:24 UTC 2026","Audit logs","admin/audit-logs.spec.ts","",""
"","492","should display all flag details on edit page","mobile-chrome","Mon Feb 16 10:54:30 UTC 2026","passed","Mon Feb 16 10:54:31 UTC 2026","Feature flag detail/edit","admin/feature-flags-detail.spec.ts","",""
"","475","should navigate to user detail from list","mobile-chrome","Mon Feb 16 10:57:00 UTC 2026","passed","Mon Feb 16 10:57:00 UTC 2026","User management","admin/user-management.spec.ts","",""
"","333","should display notifications page heading","mobile-chrome","Mon Feb 16 10:58:08 UTC 2026","passed","Mon Feb 16 10:58:08 UTC 2026","Notification center","notifications/notification-center.spec.ts","",""
"","829","should show success state after submitting valid email","chromium","Mon Feb 16 10:53:53 UTC 2026","passed","Mon Feb 16 10:53:53 UTC 2026","Forgot password page","auth/forgot-password.spec.ts","",""
"","490","should show forgot password link when no token","chromium","Mon Feb 16 10:54:16 UTC 2026","passed","Mon Feb 16 10:54:17 UTC 2026","Reset password page","auth/reset-password.spec.ts","",""
"","830","should navigate to API OAuth endpoint when clicking Google button on login","mobile-chrome","Mon Feb 16 10:57:44 UTC 2026","passed","Mon Feb 16 10:57:45 UTC 2026","Google OAuth","auth/google-oauth.spec.ts","",""
"","1542","should add tier override and see it in table","mobile-chrome","Mon Feb 16 10:56:50 UTC 2026","passed","Mon Feb 16 10:56:51 UTC 2026","Feature flag overrides","admin/feature-flags-overrides.spec.ts","",""
"","310","should show category filter tabs","mobile-chrome","Mon Feb 16 10:58:08 UTC 2026","passed","Mon Feb 16 10:58:09 UTC 2026","Notification center","notifications/notification-center.spec.ts","",""
"","405","should display registration form elements","mobile-chrome","Mon Feb 16 10:58:02 UTC 2026","passed","Mon Feb 16 10:58:02 UTC 2026","Register page","auth/register.spec.ts","",""
"","551","should show validation errors for empty form","chromium","Mon Feb 16 10:54:16 UTC 2026","passed","Mon Feb 16 10:54:16 UTC 2026","Register page","auth/register.spec.ts","",""
"","390","should redirect unauthenticated user from protected route to login","mobile-chrome","Mon Feb 16 10:58:00 UTC 2026","passed","Mon Feb 16 10:58:01 UTC 2026","Auth redirects","auth/redirect.spec.ts","",""
"","547","should show success state even for non-existent email (enumeration prevention)","mobile-chrome","Mon Feb 16 10:57:41 UTC 2026","passed","Mon Feb 16 10:57:41 UTC 2026","Forgot password page","auth/forgot-password.spec.ts","",""
"","525","should navigate back to list from detail page","chromium","Mon Feb 16 10:53:34 UTC 2026","passed","Mon Feb 16 10:53:35 UTC 2026","Feature flag detail/edit","admin/feature-flags-detail.spec.ts","",""
"","477","should show error with invalid credentials","mobile-chrome","Mon Feb 16 10:57:47 UTC 2026","passed","Mon Feb 16 10:57:48 UTC 2026","Login page","auth/login.spec.ts","",""
"","750","should navigate to API OAuth endpoint when clicking Google button on register","chromium","Mon Feb 16 10:53:57 UTC 2026","passed","Mon Feb 16 10:53:58 UTC 2026","Google OAuth","auth/google-oauth.spec.ts","",""
"","632","should switch to stats tab","chromium","Mon Feb 16 10:53:22 UTC 2026","passed","Mon Feb 16 10:53:23 UTC 2026","Admin notifications","admin/admin-notifications.spec.ts","",""
"","544","should show filter controls","chromium","Mon Feb 16 10:53:25 UTC 2026","passed","Mon Feb 16 10:53:25 UTC 2026","Audit logs","admin/audit-logs.spec.ts","",""
"","855","should show success state after submitting valid email","mobile-chrome","Mon Feb 16 10:57:40 UTC 2026","passed","Mon Feb 16 10:57:41 UTC 2026","Forgot password page","auth/forgot-password.spec.ts","",""
"","674","should show pagination controls when multiple pages","chromium","Mon Feb 16 10:53:24 UTC 2026","passed","Mon Feb 16 10:53:25 UTC 2026","Audit logs","admin/audit-logs.spec.ts","",""
"","396","should display the main heading","chromium","Mon Feb 16 10:54:19 UTC 2026","passed","Mon Feb 16 10:54:20 UTC 2026","Home page","smoke/home.spec.ts","",""
"","585","should have navigation link when no token","chromium","Mon Feb 16 10:54:18 UTC 2026","passed","Mon Feb 16 10:54:18 UTC 2026","Reset password page","auth/reset-password.spec.ts","",""
"","451","should show validation error for mismatched passwords","mobile-chrome","Mon Feb 16 10:58:06 UTC 2026","passed","Mon Feb 16 10:58:07 UTC 2026","Reset password page","auth/reset-password.spec.ts","",""
"","344","should display preferences form","mobile-chrome","Mon Feb 16 10:58:09 UTC 2026","passed","Mon Feb 16 10:58:10 UTC 2026","Notification preferences","notifications/notification-preferences.spec.ts","",""
"","388","should have Google button as type=button (not submit)","mobile-chrome","Mon Feb 16 10:57:44 UTC 2026","passed","Mon Feb 16 10:57:44 UTC 2026","Google OAuth","auth/google-oauth.spec.ts","",""
"","693","should filter by action","chromium","Mon Feb 16 10:53:23 UTC 2026","passed","Mon Feb 16 10:53:23 UTC 2026","Audit logs","admin/audit-logs.spec.ts","",""
"","371","should show forgot password link when no token","mobile-chrome","Mon Feb 16 10:58:05 UTC 2026","passed","Mon Feb 16 10:58:05 UTC 2026","Reset password page","auth/reset-password.spec.ts","",""
"","379","should display login form elements","chromium","Mon Feb 16 10:53:58 UTC 2026","passed","Mon Feb 16 10:53:58 UTC 2026","Login page","auth/login.spec.ts","",""
"","442","should show validation error for empty email submission","mobile-chrome","Mon Feb 16 10:57:41 UTC 2026","passed","Mon Feb 16 10:57:42 UTC 2026","Forgot password page","auth/forgot-password.spec.ts","",""
"","703","should filter by entity type","chromium","Mon Feb 16 10:53:25 UTC 2026","passed","Mon Feb 16 10:53:26 UTC 2026","Audit logs","admin/audit-logs.spec.ts","",""
"","1564","should update rollout percentage","chromium","Mon Feb 16 10:53:33 UTC 2026","passed","Mon Feb 16 10:53:34 UTC 2026","Feature flag detail/edit","admin/feature-flags-detail.spec.ts","",""
"","786","should navigate to API OAuth endpoint when clicking Google button on login","chromium","Mon Feb 16 10:53:56 UTC 2026","passed","Mon Feb 16 10:53:57 UTC 2026","Google OAuth","auth/google-oauth.spec.ts","",""
"","392","should display forgot password form elements","chromium","Mon Feb 16 10:53:52 UTC 2026","passed","Mon Feb 16 10:53:52 UTC 2026","Forgot password page","auth/forgot-password.spec.ts","",""
"","636","should filter by entity type","mobile-chrome","Mon Feb 16 10:54:25 UTC 2026","passed","Mon Feb 16 10:54:26 UTC 2026","Audit logs","admin/audit-logs.spec.ts","",""
"","1058","should login with valid credentials","chromium","Mon Feb 16 10:53:58 UTC 2026","passed","Mon Feb 16 10:53:59 UTC 2026","Login page","auth/login.spec.ts","",""
"","517","should display audit logs table","chromium","Mon Feb 16 10:53:23 UTC 2026","passed","Mon Feb 16 10:53:23 UTC 2026","Audit logs","admin/audit-logs.spec.ts","",""
"","686","should switch to broadcast tab","chromium","Mon Feb 16 10:53:22 UTC 2026","passed","Mon Feb 16 10:53:23 UTC 2026","Admin notifications","admin/admin-notifications.spec.ts","",""
"","287","should stay on root URL (no locale prefix)","mobile-chrome","Mon Feb 16 10:58:10 UTC 2026","passed","Mon Feb 16 10:58:11 UTC 2026","Home page","smoke/home.spec.ts","",""
"","443","should show validation error for short password","mobile-chrome","Mon Feb 16 10:58:07 UTC 2026","passed","Mon Feb 16 10:58:07 UTC 2026","Reset password page","auth/reset-password.spec.ts","",""
"","601","should allow access to register page","chromium","Mon Feb 16 10:54:14 UTC 2026","passed","Mon Feb 16 10:54:14 UTC 2026","Auth redirects","auth/redirect.spec.ts","",""
"","1092","should reset filters","chromium","Mon Feb 16 10:53:26 UTC 2026","passed","Mon Feb 16 10:53:27 UTC 2026","Audit logs","admin/audit-logs.spec.ts","",""
"","1903","should show error when reusing an already-used token","chromium","Mon Feb 16 10:54:05 UTC 2026","passed","Mon Feb 16 10:54:07 UTC 2026","Password reset flow (E2E)","auth/password-reset-flow.spec.ts","",""
"","462","should toggle flag from list","chromium","Mon Feb 16 10:53:44 UTC 2026","passed","Mon Feb 16 10:53:44 UTC 2026","Feature flag management","admin/feature-flags.spec.ts","",""
"","506","should have navigation link when no token","mobile-chrome","Mon Feb 16 10:58:08 UTC 2026","passed","Mon Feb 16 10:58:08 UTC 2026","Reset password page","auth/reset-password.spec.ts","",""
"","2451","should remove override from table","chromium","Mon Feb 16 10:53:39 UTC 2026","passed","Mon Feb 16 10:53:42 UTC 2026","Feature flag overrides","admin/feature-flags-overrides.spec.ts","",""
"","878","should show error for duplicate email","mobile-chrome","Mon Feb 16 10:58:03 UTC 2026","passed","Mon Feb 16 10:58:04 UTC 2026","Register page","auth/register.spec.ts","",""
"","4624","should not send email for non-existent user","mobile-chrome","Mon Feb 16 10:57:56 UTC 2026","passed","Mon Feb 16 10:58:00 UTC 2026","Password reset flow (E2E)","auth/password-reset-flow.spec.ts","",""
"","45433","should update rollout percentage","mobile-chrome","Mon Feb 16 11:02:39 UTC 2026","broken","Mon Feb 16 11:03:25 UTC 2026","Feature flag detail/edit","admin/feature-flags-detail.spec.ts","",""
"","370","should display preferences form","chromium","Mon Feb 16 10:54:19 UTC 2026","passed","Mon Feb 16 10:54:19 UTC 2026","Notification preferences","notifications/notification-preferences.spec.ts","",""
"","380","should display Google sign-in button on register page","mobile-chrome","Mon Feb 16 10:57:43 UTC 2026","passed","Mon Feb 16 10:57:44 UTC 2026","Google OAuth","auth/google-oauth.spec.ts","",""
"","555","should toggle flag from list","mobile-chrome","Mon Feb 16 10:56:56 UTC 2026","passed","Mon Feb 16 10:56:57 UTC 2026","Feature flag management","admin/feature-flags.spec.ts","",""
"","799","should create new user via admin form","mobile-chrome","Mon Feb 16 10:57:01 UTC 2026","passed","Mon Feb 16 10:57:02 UTC 2026","User management","admin/user-management.spec.ts","",""
