"DESCRIPTION","DURATION IN MS","NAME","PARENT SUITE","START TIME","STATUS","STOP TIME","SUB SUITE","SUITE","TEST CLASS","TEST METHOD"
"","560","should show validation error for mismatched passwords","chromium","Sun Feb 15 21:11:38 UTC 2026","passed","Sun Feb 15 21:11:38 UTC 2026","Reset password page","auth/reset-password.spec.ts","",""
"","612","should show success state even for non-existent email (enumeration prevention)","mobile-chrome","Sun Feb 15 21:15:50 UTC 2026","passed","Sun Feb 15 21:15:51 UTC 2026","Forgot password page","auth/forgot-password.spec.ts","",""
"","749","should navigate to API OAuth endpoint when clicking Google button on login","chromium","Sun Feb 15 21:11:18 UTC 2026","passed","Sun Feb 15 21:11:19 UTC 2026","Google OAuth","auth/google-oauth.spec.ts","",""
"","1159","authenticate as admin user","auth-setup","Sun Feb 15 21:19:50 UTC 2026","passed","Sun Feb 15 21:19:51 UTC 2026","","../src/auth/auth.setup.ts","",""
"","1948","should show error when reusing an already-used token","chromium","Sun Feb 15 21:11:27 UTC 2026","passed","Sun Feb 15 21:11:28 UTC 2026","Password reset flow (E2E)","auth/password-reset-flow.spec.ts","",""
"","480","should show key as read-only on edit page","mobile-chrome","Sun Feb 15 21:11:53 UTC 2026","passed","Sun Feb 15 21:11:54 UTC 2026","Feature flag detail/edit","admin/feature-flags-detail.spec.ts","",""
"","382","should have Google button as type=button (not submit)","mobile-chrome","Sun Feb 15 21:15:53 UTC 2026","passed","Sun Feb 15 21:15:54 UTC 2026","Google OAuth","auth/google-oauth.spec.ts","",""
"","422","should create flag with all fields filled","chromium","Sun Feb 15 21:10:50 UTC 2026","passed","Sun Feb 15 21:10:51 UTC 2026","Feature flag creation","admin/feature-flags-create.spec.ts","",""
"","892","should create new user via admin form","mobile-chrome","Sun Feb 15 21:15:43 UTC 2026","passed","Sun Feb 15 21:15:44 UTC 2026","User management","admin/user-management.spec.ts","",""
"","358","should display Google sign-in button on login page","chromium","Sun Feb 15 21:11:17 UTC 2026","passed","Sun Feb 15 21:11:18 UTC 2026","Google OAuth","auth/google-oauth.spec.ts","",""
"","1916","should complete full password reset flow (forgot -> email -> reset -> login)","mobile-chrome","Sun Feb 15 21:15:58 UTC 2026","passed","Sun Feb 15 21:16:00 UTC 2026","Password reset flow (E2E)","auth/password-reset-flow.spec.ts","",""
"","422","should navigate to user detail from list","chromium","Sun Feb 15 21:11:09 UTC 2026","passed","Sun Feb 15 21:11:10 UTC 2026","User management","admin/user-management.spec.ts","",""
"","486","should display overrides section on detail page","mobile-chrome","Sun Feb 15 21:20:40 UTC 2026","failed","Sun Feb 15 21:20:40 UTC 2026","Feature flag overrides","admin/feature-flags-overrides.spec.ts","",""
"","261","should display user list","chromium","Sun Feb 15 21:11:08 UTC 2026","passed","Sun Feb 15 21:11:08 UTC 2026","User management","admin/user-management.spec.ts","",""
"","295","should display the main heading","mobile-chrome","Sun Feb 15 21:16:17 UTC 2026","passed","Sun Feb 15 21:16:18 UTC 2026","Home page","smoke/home.spec.ts","",""
"","4748","should not send email for non-existent user","chromium","Sun Feb 15 21:11:30 UTC 2026","passed","Sun Feb 15 21:11:34 UTC 2026","Password reset flow (E2E)","auth/password-reset-flow.spec.ts","",""
"","498","should allow access to register page","chromium","Sun Feb 15 21:11:34 UTC 2026","passed","Sun Feb 15 21:11:35 UTC 2026","Auth redirects","auth/redirect.spec.ts","",""
"","1207","should send email to registered user","mobile-chrome","Sun Feb 15 21:16:04 UTC 2026","passed","Sun Feb 15 21:16:05 UTC 2026","Password reset flow (E2E)","auth/password-reset-flow.spec.ts","",""
"","499","should navigate back to list from detail page","mobile-chrome","Sun Feb 15 21:11:52 UTC 2026","passed","Sun Feb 15 21:11:53 UTC 2026","Feature flag detail/edit","admin/feature-flags-detail.spec.ts","",""
"","1875","should complete full password reset flow (forgot -> email -> reset -> login)","chromium","Sun Feb 15 21:11:22 UTC 2026","passed","Sun Feb 15 21:11:24 UTC 2026","Password reset flow (E2E)","auth/password-reset-flow.spec.ts","",""
"","613","should filter by entity type","mobile-chrome","Sun Feb 15 21:11:43 UTC 2026","passed","Sun Feb 15 21:11:44 UTC 2026","Audit logs","admin/audit-logs.spec.ts","",""
"","286","should show validation errors on invalid create","chromium","Sun Feb 15 21:11:11 UTC 2026","passed","Sun Feb 15 21:11:11 UTC 2026","User management","admin/user-management.spec.ts","",""
"","273","should display all form fields","chromium","Sun Feb 15 21:10:52 UTC 2026","passed","Sun Feb 15 21:10:52 UTC 2026","Feature flag creation","admin/feature-flags-create.spec.ts","",""
"","698","should filter by action","mobile-chrome","Sun Feb 15 21:11:41 UTC 2026","passed","Sun Feb 15 21:11:42 UTC 2026","Audit logs","admin/audit-logs.spec.ts","",""
"","521","should have navigation link when no token","mobile-chrome","Sun Feb 15 21:16:17 UTC 2026","passed","Sun Feb 15 21:16:17 UTC 2026","Reset password page","auth/reset-password.spec.ts","",""
"","1147","authenticate as basic user","auth-setup","Sun Feb 15 21:19:50 UTC 2026","passed","Sun Feb 15 21:19:51 UTC 2026","","../src/auth/auth.setup.ts","",""
"","512","should display all flag details on edit page","chromium","Sun Feb 15 21:10:52 UTC 2026","passed","Sun Feb 15 21:10:53 UTC 2026","Feature flag detail/edit","admin/feature-flags-detail.spec.ts","",""
"","1209","should send email to registered user","chromium","Sun Feb 15 21:11:28 UTC 2026","passed","Sun Feb 15 21:11:30 UTC 2026","Password reset flow (E2E)","auth/password-reset-flow.spec.ts","",""
"","464","should have link back to login page and navigate to it","chromium","Sun Feb 15 21:11:17 UTC 2026","passed","Sun Feb 15 21:11:17 UTC 2026","Forgot password page","auth/forgot-password.spec.ts","",""
"","465","should export CSV","chromium","Sun Feb 15 21:10:48 UTC 2026","passed","Sun Feb 15 21:10:48 UTC 2026","Audit logs","admin/audit-logs.spec.ts","",""
"","408","should display registration form elements","mobile-chrome","Sun Feb 15 21:16:11 UTC 2026","passed","Sun Feb 15 21:16:12 UTC 2026","Register page","auth/register.spec.ts","",""
"","282","should display feature flags list","chromium","Sun Feb 15 21:11:04 UTC 2026","passed","Sun Feb 15 21:11:04 UTC 2026","Feature flag management","admin/feature-flags.spec.ts","",""
