"DESCRIPTION","DURATION IN MS","NAME","PARENT SUITE","START TIME","STATUS","STOP TIME","SUB SUITE","SUITE","TEST CLASS","TEST METHOD"
"","429","should display user list","mobile-chrome","Sun Feb 15 21:15:41 UTC 2026","passed","Sun Feb 15 21:15:41 UTC 2026","User management","admin/user-management.spec.ts","",""
"","45356","should toggle flag from list","mobile-chrome","Sun Feb 15 21:23:48 UTC 2026","broken","Sun Feb 15 21:24:33 UTC 2026","Feature flag management","admin/feature-flags.spec.ts","",""
"","408","should display the main heading","chromium","Sun Feb 15 21:11:39 UTC 2026","passed","Sun Feb 15 21:11:39 UTC 2026","Home page","smoke/home.spec.ts","",""
"","635","should update user profile","mobile-chrome","Sun Feb 15 21:15:43 UTC 2026","passed","Sun Feb 15 21:15:43 UTC 2026","User management","admin/user-management.spec.ts","",""
"","634","should show validation errors for empty form","chromium","Sun Feb 15 21:11:36 UTC 2026","passed","Sun Feb 15 21:11:37 UTC 2026","Register page","auth/register.spec.ts","",""
"","530","should toggle flag from list","chromium","Sun Feb 15 21:11:06 UTC 2026","passed","Sun Feb 15 21:11:06 UTC 2026","Feature flag management","admin/feature-flags.spec.ts","",""
"","272","should stay on root URL (no locale prefix)","mobile-chrome","Sun Feb 15 21:16:18 UTC 2026","passed","Sun Feb 15 21:16:18 UTC 2026","Home page","smoke/home.spec.ts","",""
"","538","should navigate to centralized audit page filtered by feature flag","mobile-chrome","Sun Feb 15 21:11:45 UTC 2026","passed","Sun Feb 15 21:11:45 UTC 2026","Feature flag audit log (centralized)","admin/feature-flags-audit.spec.ts","",""
"","388","should allow access to register page","mobile-chrome","Sun Feb 15 21:16:11 UTC 2026","passed","Sun Feb 15 21:16:11 UTC 2026","Auth redirects","auth/redirect.spec.ts","",""
"","855","should show success state after submitting valid email","chromium","Sun Feb 15 21:11:15 UTC 2026","passed","Sun Feb 15 21:11:16 UTC 2026","Forgot password page","auth/forgot-password.spec.ts","",""
"","503","should display all flag details on edit page","mobile-chrome","Sun Feb 15 21:11:48 UTC 2026","passed","Sun Feb 15 21:11:49 UTC 2026","Feature flag detail/edit","admin/feature-flags-detail.spec.ts","",""
"","392","should display forgot password form elements","chromium","Sun Feb 15 21:11:14 UTC 2026","passed","Sun Feb 15 21:11:14 UTC 2026","Forgot password page","auth/forgot-password.spec.ts","",""
"","530","should update user profile","chromium","Sun Feb 15 21:11:10 UTC 2026","passed","Sun Feb 15 21:11:10 UTC 2026","User management","admin/user-management.spec.ts","",""
"","4630","should not send email for non-existent user","mobile-chrome","Sun Feb 15 21:16:05 UTC 2026","passed","Sun Feb 15 21:16:10 UTC 2026","Password reset flow (E2E)","auth/password-reset-flow.spec.ts","",""
"","458","should navigate back to list from detail page","chromium","Sun Feb 15 21:10:56 UTC 2026","passed","Sun Feb 15 21:10:57 UTC 2026","Feature flag detail/edit","admin/feature-flags-detail.spec.ts","",""
"","473","should delete flag from list","chromium","Sun Feb 15 21:11:07 UTC 2026","passed","Sun Feb 15 21:11:08 UTC 2026","Feature flag management","admin/feature-flags.spec.ts","",""
"","509","should update flag details","chromium","Sun Feb 15 21:11:07 UTC 2026","passed","Sun Feb 15 21:11:07 UTC 2026","Feature flag management","admin/feature-flags.spec.ts","",""
"","373","should show validation for blank name","chromium","Sun Feb 15 21:10:52 UTC 2026","passed","Sun Feb 15 21:10:52 UTC 2026","Feature flag creation","admin/feature-flags-create.spec.ts","",""
"","615","should have navigation link when no token","chromium","Sun Feb 15 21:11:38 UTC 2026","passed","Sun Feb 15 21:11:39 UTC 2026","Reset password page","auth/reset-password.spec.ts","",""
"","708","should show error for invalid token on submit","chromium","Sun Feb 15 21:11:38 UTC 2026","passed","Sun Feb 15 21:11:39 UTC 2026","Reset password page","auth/reset-password.spec.ts","",""
"","585","should display audit logs table","chromium","Sun Feb 15 21:10:43 UTC 2026","passed","Sun Feb 15 21:10:43 UTC 2026","Audit logs","admin/audit-logs.spec.ts","",""
"","45347","should remove override from table","mobile-chrome","Sun Feb 15 21:20:40 UTC 2026","broken","Sun Feb 15 21:21:25 UTC 2026","Feature flag overrides","admin/feature-flags-overrides.spec.ts","",""
"","313","should allow access to public home page","mobile-chrome","Sun Feb 15 21:16:10 UTC 2026","passed","Sun Feb 15 21:16:10 UTC 2026","Auth redirects","auth/redirect.spec.ts","",""
"","1506","should update rollout percentage","chromium","Sun Feb 15 21:10:55 UTC 2026","passed","Sun Feb 15 21:10:56 UTC 2026","Feature flag detail/edit","admin/feature-flags-detail.spec.ts","",""
"","444","should display correct table columns","chromium","Sun Feb 15 21:10:44 UTC 2026","passed","Sun Feb 15 21:10:45 UTC 2026","Audit logs","admin/audit-logs.spec.ts","",""
"","1030","should reset filters","mobile-chrome","Sun Feb 15 21:11:44 UTC 2026","passed","Sun Feb 15 21:11:45 UTC 2026","Audit logs","admin/audit-logs.spec.ts","",""
"","570","should display correct table columns","mobile-chrome","Sun Feb 15 21:11:42 UTC 2026","passed","Sun Feb 15 21:11:42 UTC 2026","Audit logs","admin/audit-logs.spec.ts","",""
"","403","should display Google sign-in button on login page","mobile-chrome","Sun Feb 15 21:15:52 UTC 2026","passed","Sun Feb 15 21:15:53 UTC 2026","Google OAuth","auth/google-oauth.spec.ts","",""
"","466","should navigate to centralized audit page filtered by feature flag","chromium","Sun Feb 15 21:10:49 UTC 2026","passed","Sun Feb 15 21:10:50 UTC 2026","Feature flag audit log (centralized)","admin/feature-flags-audit.spec.ts","",""
"","519","should change user tier","chromium","Sun Feb 15 21:11:12 UTC 2026","passed","Sun Feb 15 21:11:13 UTC 2026","User management","admin/user-management.spec.ts","",""
"","401","should navigate to create flag page","chromium","Sun Feb 15 21:11:05 UTC 2026","passed","Sun Feb 15 21:11:05 UTC 2026","Feature flag management","admin/feature-flags.spec.ts","",""
"","453","should show validation errors on invalid create","mobile-chrome","Sun Feb 15 21:15:44 UTC 2026","passed","Sun Feb 15 21:15:45 UTC 2026","User management","admin/user-management.spec.ts","",""
"","326","should cancel creation and return to list","mobile-chrome","Sun Feb 15 21:11:47 UTC 2026","passed","Sun Feb 15 21:11:47 UTC 2026","Feature flag creation","admin/feature-flags-create.spec.ts","",""
"","1520","should update flag name and verify persistence","chromium","Sun Feb 15 21:10:53 UTC 2026","passed","Sun Feb 15 21:10:55 UTC 2026","Feature flag detail/edit","admin/feature-flags-detail.spec.ts","",""
"","564","should show error with invalid credentials","mobile-chrome","Sun Feb 15 21:15:57 UTC 2026","passed","Sun Feb 15 21:15:57 UTC 2026","Login page","auth/login.spec.ts","",""
"","1457","should update description and verify persistence","mobile-chrome","Sun Feb 15 21:11:54 UTC 2026","passed","Sun Feb 15 21:11:55 UTC 2026","Feature flag detail/edit","admin/feature-flags-detail.spec.ts","",""
"","1074","should show error for duplicate email","chromium","Sun Feb 15 21:11:36 UTC 2026","passed","Sun Feb 15 21:11:37 UTC 2026","Register page","auth/register.spec.ts","",""
"","1027","should reset filters","chromium","Sun Feb 15 21:10:48 UTC 2026","passed","Sun Feb 15 21:10:49 UTC 2026","Audit logs","admin/audit-logs.spec.ts","",""
"","539","should show validation error for invalid email format","mobile-chrome","Sun Feb 15 21:15:51 UTC 2026","passed","Sun Feb 15 21:15:52 UTC 2026","Forgot password page","auth/forgot-password.spec.ts","",""
"","417","should navigate to flag detail from list","chromium","Sun Feb 15 21:11:05 UTC 2026","passed","Sun Feb 15 21:11:06 UTC 2026","Feature flag management","admin/feature-flags.spec.ts","",""
"","430","should show validation error for short password","mobile-chrome","Sun Feb 15 21:16:16 UTC 2026","passed","Sun Feb 15 21:16:16 UTC 2026","Reset password page","auth/reset-password.spec.ts","",""
"","466","should show validation error for empty form","mobile-chrome","Sun Feb 15 21:15:57 UTC 2026","passed","Sun Feb 15 21:15:58 UTC 2026","Login page","auth/login.spec.ts","",""
"","462","should show validation error for empty password fields","mobile-chrome","Sun Feb 15 21:16:15 UTC 2026","passed","Sun Feb 15 21:16:15 UTC 2026","Reset password page","auth/reset-password.spec.ts","",""
"","384","should display Google sign-in button on register page","mobile-chrome","Sun Feb 15 21:15:53 UTC 2026","passed","Sun Feb 15 21:15:53 UTC 2026","Google OAuth","auth/google-oauth.spec.ts","",""
"","331","should cancel creation and return to list","chromium","Sun Feb 15 21:10:51 UTC 2026","passed","Sun Feb 15 21:10:52 UTC 2026","Feature flag creation","admin/feature-flags-create.spec.ts","",""
"","712","should navigate to API OAuth endpoint when clicking Google button on login","mobile-chrome","Sun Feb 15 21:15:54 UTC 2026","passed","Sun Feb 15 21:15:54 UTC 2026","Google OAuth","auth/google-oauth.spec.ts","",""
"","1425","should update description and verify persistence","chromium","Sun Feb 15 21:10:58 UTC 2026","passed","Sun Feb 15 21:10:59 UTC 2026","Feature flag detail/edit","admin/feature-flags-detail.spec.ts","",""
"","465","should display overrides section on detail page","chromium","Sun Feb 15 21:10:59 UTC 2026","passed","Sun Feb 15 21:10:59 UTC 2026","Feature flag overrides","admin/feature-flags-overrides.spec.ts","",""
"","525","should show error for invalid token on submit","mobile-chrome","Sun Feb 15 21:16:16 UTC 2026","passed","Sun Feb 15 21:16:17 UTC 2026","Reset password page","auth/reset-password.spec.ts","",""
"","454","should display reset password form with token in URL","chromium","Sun Feb 15 21:11:37 UTC 2026","passed","Sun Feb 15 21:11:38 UTC 2026","Reset password page","auth/reset-password.spec.ts","",""
"","665","should show validation error for empty email submission","mobile-chrome","Sun Feb 15 21:15:51 UTC 2026","passed","Sun Feb 15 21:15:51 UTC 2026","Forgot password page","auth/forgot-password.spec.ts","",""
"","451","should show validation error for mismatched passwords","mobile-chrome","Sun Feb 15 21:16:15 UTC 2026","passed","Sun Feb 15 21:16:16 UTC 2026","Reset password page","auth/reset-password.spec.ts","",""
"","436","should show validation error for invalid email format","chromium","Sun Feb 15 21:11:16 UTC 2026","passed","Sun Feb 15 21:11:17 UTC 2026","Forgot password page","auth/forgot-password.spec.ts","",""
"","701","should have audit log link on feature flag detail page","mobile-chrome","Sun Feb 15 21:12:31 UTC 2026","passed","Sun Feb 15 21:12:31 UTC 2026","Feature flag audit log (centralized)","admin/feature-flags-audit.spec.ts","",""
"","544","should show validation error for empty password fields","chromium","Sun Feb 15 21:11:37 UTC 2026","passed","Sun Feb 15 21:11:38 UTC 2026","Reset password page","auth/reset-password.spec.ts","",""
"","412","should create flag with minimum required fields only","mobile-chrome","Sun Feb 15 21:11:47 UTC 2026","passed","Sun Feb 15 21:11:47 UTC 2026","Feature flag creation","admin/feature-flags-create.spec.ts","",""
"","630","should have audit log link on feature flag detail page","chromium","Sun Feb 15 21:11:32 UTC 2026","passed","Sun Feb 15 21:11:33 UTC 2026","Feature flag audit log (centralized)","admin/feature-flags-audit.spec.ts","",""
"","433","should show key as read-only on edit page","chromium","Sun Feb 15 21:10:57 UTC 2026","passed","Sun Feb 15 21:10:58 UTC 2026","Feature flag detail/edit","admin/feature-flags-detail.spec.ts","",""
"","613","should export CSV","mobile-chrome","Sun Feb 15 21:11:43 UTC 2026","passed","Sun Feb 15 21:11:44 UTC 2026","Audit logs","admin/audit-logs.spec.ts","",""
"","45439","should add tier override and see it in table","mobile-chrome","Sun Feb 15 21:20:42 UTC 2026","broken","Sun Feb 15 21:21:27 UTC 2026","Feature flag overrides","admin/feature-flags-overrides.spec.ts","",""
"","439","should show pagination controls when multiple pages","chromium","Sun Feb 15 21:10:47 UTC 2026","passed","Sun Feb 15 21:10:48 UTC 2026","Audit logs","admin/audit-logs.spec.ts","",""
"","1641","should update flag name and verify persistence","mobile-chrome","Sun Feb 15 21:11:49 UTC 2026","passed","Sun Feb 15 21:11:51 UTC 2026","Feature flag detail/edit","admin/feature-flags-detail.spec.ts","",""
"","483","should delete user from detail page","chromium","Sun Feb 15 21:11:13 UTC 2026","passed","Sun Feb 15 21:11:14 UTC 2026","User management","admin/user-management.spec.ts","",""
"","474","should show error when no token in URL","chromium","Sun Feb 15 21:11:37 UTC 2026","passed","Sun Feb 15 21:11:37 UTC 2026","Reset password page","auth/reset-password.spec.ts","",""
"","380","should display all form fields","mobile-chrome","Sun Feb 15 21:11:47 UTC 2026","passed","Sun Feb 15 21:11:48 UTC 2026","Feature flag creation","admin/feature-flags-create.spec.ts","",""
"","687","should navigate to API OAuth endpoint when clicking Google button on register","chromium","Sun Feb 15 21:11:19 UTC 2026","passed","Sun Feb 15 21:11:20 UTC 2026","Google OAuth","auth/google-oauth.spec.ts","",""
"","248","should display create flag form elements","chromium","Sun Feb 15 21:11:05 UTC 2026","passed","Sun Feb 15 21:11:05 UTC 2026","Feature flag management","admin/feature-flags.spec.ts","",""
"","544","should filter by entity type","chromium","Sun Feb 15 21:10:45 UTC 2026","passed","Sun Feb 15 21:10:46 UTC 2026","Audit logs","admin/audit-logs.spec.ts","",""
"","495","should show success state even for non-existent email (enumeration prevention)","chromium","Sun Feb 15 21:11:16 UTC 2026","passed","Sun Feb 15 21:11:16 UTC 2026","Forgot password page","auth/forgot-password.spec.ts","",""
"","501","should allow access to login page","chromium","Sun Feb 15 21:11:34 UTC 2026","passed","Sun Feb 15 21:11:35 UTC 2026","Auth redirects","auth/redirect.spec.ts","",""
"","288","should display Ukrainian content by default","mobile-chrome","Sun Feb 15 21:16:18 UTC 2026","passed","Sun Feb 15 21:16:18 UTC 2026","Home page","smoke/home.spec.ts","",""
"","516","should show forgot password link when no token","chromium","Sun Feb 15 21:11:37 UTC 2026","passed","Sun Feb 15 21:11:37 UTC 2026","Reset password page","auth/reset-password.spec.ts","",""
"","733","should navigate to API OAuth endpoint when clicking Google button on register","mobile-chrome","Sun Feb 15 21:15:54 UTC 2026","passed","Sun Feb 15 21:15:55 UTC 2026","Google OAuth","auth/google-oauth.spec.ts","",""
"","428","should create flag with all fields filled","mobile-chrome","Sun Feb 15 21:11:46 UTC 2026","passed","Sun Feb 15 21:11:46 UTC 2026","Feature flag creation","admin/feature-flags-create.spec.ts","",""
"","361","should create flag with minimum required fields only","chromium","Sun Feb 15 21:10:51 UTC 2026","passed","Sun Feb 15 21:10:51 UTC 2026","Feature flag creation","admin/feature-flags-create.spec.ts","",""
"","400","should show validation error for empty email submission","chromium","Sun Feb 15 21:11:16 UTC 2026","passed","Sun Feb 15 21:11:16 UTC 2026","Forgot password page","auth/forgot-password.spec.ts","",""
"","2258","should not be able to login with old password after reset","chromium","Sun Feb 15 21:11:24 UTC 2026","passed","Sun Feb 15 21:11:26 UTC 2026","Password reset flow (E2E)","auth/password-reset-flow.spec.ts","",""
"","45594","should update flag details","mobile-chrome","Sun Feb 15 21:22:16 UTC 2026","broken","Sun Feb 15 21:23:02 UTC 2026","Feature flag management","admin/feature-flags.spec.ts","",""
"","724","should toggle user status","mobile-chrome","Sun Feb 15 21:15:47 UTC 2026","passed","Sun Feb 15 21:15:47 UTC 2026","User management","admin/user-management.spec.ts","",""
"","738","should create new user via admin form","chromium","Sun Feb 15 21:11:10 UTC 2026","passed","Sun Feb 15 21:11:11 UTC 2026","User management","admin/user-management.spec.ts","",""
"","557","should toggle user status","chromium","Sun Feb 15 21:11:13 UTC 2026","passed","Sun Feb 15 21:11:13 UTC 2026","User management","admin/user-management.spec.ts","",""
"","898","should filter by action","chromium","Sun Feb 15 21:10:45 UTC 2026","passed","Sun Feb 15 21:10:46 UTC 2026","Audit logs","admin/audit-logs.spec.ts","",""
"","692","should change user tier","mobile-chrome","Sun Feb 15 21:15:46 UTC 2026","passed","Sun Feb 15 21:15:46 UTC 2026","User management","admin/user-management.spec.ts","",""
"","541","should show pagination controls when multiple pages","mobile-chrome","Sun Feb 15 21:11:42 UTC 2026","passed","Sun Feb 15 21:11:43 UTC 2026","Audit logs","admin/audit-logs.spec.ts","",""
"","430","should show validation error for invalid key format","mobile-chrome","Sun Feb 15 21:11:46 UTC 2026","passed","Sun Feb 15 21:11:47 UTC 2026","Feature flag creation","admin/feature-flags-create.spec.ts","",""
"","415","should display feature flags list","mobile-chrome","Sun Feb 15 21:14:06 UTC 2026","passed","Sun Feb 15 21:14:06 UTC 2026","Feature flag management","admin/feature-flags.spec.ts","",""
"","566","should allow access to forgot password page","mobile-chrome","Sun Feb 15 21:15:48 UTC 2026","passed","Sun Feb 15 21:15:49 UTC 2026","Forgot password page","auth/forgot-password.spec.ts","",""
"","393","should show validation for blank name","mobile-chrome","Sun Feb 15 21:11:48 UTC 2026","passed","Sun Feb 15 21:11:48 UTC 2026","Feature flag creation","admin/feature-flags-create.spec.ts","",""
"","2529","should remove override from table","chromium","Sun Feb 15 21:11:01 UTC 2026","passed","Sun Feb 15 21:11:04 UTC 2026","Feature flag overrides","admin/feature-flags-overrides.spec.ts","",""
"","45336","should navigate to flag detail from list","mobile-chrome","Sun Feb 15 21:22:14 UTC 2026","broken","Sun Feb 15 21:22:59 UTC 2026","Feature flag management","admin/feature-flags.spec.ts","",""
"","815","should register with valid data","mobile-chrome","Sun Feb 15 21:16:12 UTC 2026","passed","Sun Feb 15 21:16:13 UTC 2026","Register page","auth/register.spec.ts","",""
"","589","should show validation error for short password","chromium","Sun Feb 15 21:11:38 UTC 2026","passed","Sun Feb 15 21:11:38 UTC 2026","Reset password page","auth/reset-password.spec.ts","",""
"","506","should show error with invalid credentials","chromium","Sun Feb 15 21:11:21 UTC 2026","passed","Sun Feb 15 21:11:22 UTC 2026","Login page","auth/login.spec.ts","",""
"","356","should show error when no token in URL","mobile-chrome","Sun Feb 15 21:16:14 UTC 2026","passed","Sun Feb 15 21:16:14 UTC 2026","Reset password page","auth/reset-password.spec.ts","",""
"","450","should navigate to create flag page","mobile-chrome","Sun Feb 15 21:14:06 UTC 2026","passed","Sun Feb 15 21:14:07 UTC 2026","Feature flag management","admin/feature-flags.spec.ts","",""
"","337","should display Ukrainian content by default","chromium","Sun Feb 15 21:11:39 UTC 2026","passed","Sun Feb 15 21:11:40 UTC 2026","Home page","smoke/home.spec.ts","",""
"","45304","should delete flag from list","mobile-chrome","Sun Feb 15 21:23:50 UTC 2026","broken","Sun Feb 15 21:24:36 UTC 2026","Feature flag management","admin/feature-flags.spec.ts","",""
"","542","should navigate to user detail from list","mobile-chrome","Sun Feb 15 21:15:42 UTC 2026","passed","Sun Feb 15 21:15:43 UTC 2026","User management","admin/user-management.spec.ts","",""
"","480","should show validation errors for empty form","mobile-chrome","Sun Feb 15 21:16:13 UTC 2026","passed","Sun Feb 15 21:16:14 UTC 2026","Register page","auth/register.spec.ts","",""
"","354","should allow access to forgot password page","chromium","Sun Feb 15 21:11:14 UTC 2026","passed","Sun Feb 15 21:11:15 UTC 2026","Forgot password page","auth/forgot-password.spec.ts","",""
"","401","should show validation error for empty form","chromium","Sun Feb 15 21:11:22 UTC 2026","passed","Sun Feb 15 21:11:22 UTC 2026","Login page","auth/login.spec.ts","",""
"","921","should register with valid data","chromium","Sun Feb 15 21:11:35 UTC 2026","passed","Sun Feb 15 21:11:36 UTC 2026","Register page","auth/register.spec.ts","",""
"","380","should redirect unauthenticated user from protected route to login","chromium","Sun Feb 15 21:11:34 UTC 2026","passed","Sun Feb 15 21:11:34 UTC 2026","Auth redirects","auth/redirect.spec.ts","",""
"","1102","should login with valid credentials","mobile-chrome","Sun Feb 15 21:15:56 UTC 2026","passed","Sun Feb 15 21:15:57 UTC 2026","Login page","auth/login.spec.ts","",""
"","579","should show filter controls","mobile-chrome","Sun Feb 15 21:11:43 UTC 2026","passed","Sun Feb 15 21:11:43 UTC 2026","Audit logs","admin/audit-logs.spec.ts","",""
"","1071","should login with valid credentials","chromium","Sun Feb 15 21:11:20 UTC 2026","passed","Sun Feb 15 21:11:21 UTC 2026","Login page","auth/login.spec.ts","",""
"","344","should show validation error for invalid key format","chromium","Sun Feb 15 21:10:51 UTC 2026","passed","Sun Feb 15 21:10:51 UTC 2026","Feature flag creation","admin/feature-flags-create.spec.ts","",""
"","804","should show error for duplicate email","mobile-chrome","Sun Feb 15 21:16:13 UTC 2026","passed","Sun Feb 15 21:16:13 UTC 2026","Register page","auth/register.spec.ts","",""
"","284","should show pagination when many flags exist","chromium","Sun Feb 15 21:11:08 UTC 2026","passed","Sun Feb 15 21:11:08 UTC 2026","Feature flag management","admin/feature-flags.spec.ts","",""
"","1955","should show error when reusing an already-used token","mobile-chrome","Sun Feb 15 21:16:02 UTC 2026","passed","Sun Feb 15 21:16:04 UTC 2026","Password reset flow (E2E)","auth/password-reset-flow.spec.ts","",""
"","385","should display reset password form with token in URL","mobile-chrome","Sun Feb 15 21:16:15 UTC 2026","passed","Sun Feb 15 21:16:15 UTC 2026","Reset password page","auth/reset-password.spec.ts","",""
"","366","should allow access to public home page","chromium","Sun Feb 15 21:11:34 UTC 2026","passed","Sun Feb 15 21:11:34 UTC 2026","Auth redirects","auth/redirect.spec.ts","",""
"","1590","should update rollout percentage","mobile-chrome","Sun Feb 15 21:11:51 UTC 2026","passed","Sun Feb 15 21:11:52 UTC 2026","Feature flag detail/edit","admin/feature-flags-detail.spec.ts","",""
"","518","should have link back to login page and navigate to it","mobile-chrome","Sun Feb 15 21:15:52 UTC 2026","passed","Sun Feb 15 21:15:52 UTC 2026","Forgot password page","auth/forgot-password.spec.ts","",""
"","397","should redirect unauthenticated user from protected route to login","mobile-chrome","Sun Feb 15 21:16:10 UTC 2026","passed","Sun Feb 15 21:16:10 UTC 2026","Auth redirects","auth/redirect.spec.ts","",""
"","478","should display forgot password form elements","mobile-chrome","Sun Feb 15 21:15:48 UTC 2026","passed","Sun Feb 15 21:15:48 UTC 2026","Forgot password page","auth/forgot-password.spec.ts","",""
"","1038","should show success state after submitting valid email","mobile-chrome","Sun Feb 15 21:15:49 UTC 2026","passed","Sun Feb 15 21:15:50 UTC 2026","Forgot password page","auth/forgot-password.spec.ts","",""
"","380","should allow access to login page","mobile-chrome","Sun Feb 15 21:16:11 UTC 2026","passed","Sun Feb 15 21:16:11 UTC 2026","Auth redirects","auth/redirect.spec.ts","",""
"","664","should delete user from detail page","mobile-chrome","Sun Feb 15 21:15:47 UTC 2026","passed","Sun Feb 15 21:15:48 UTC 2026","User management","admin/user-management.spec.ts","",""
"","535","should display registration form elements","chromium","Sun Feb 15 21:11:35 UTC 2026","passed","Sun Feb 15 21:11:35 UTC 2026","Register page","auth/register.spec.ts","",""
"","402","should display login form elements","mobile-chrome","Sun Feb 15 21:15:55 UTC 2026","passed","Sun Feb 15 21:15:56 UTC 2026","Login page","auth/login.spec.ts","",""
"","415","should show pagination when many flags exist","mobile-chrome","Sun Feb 15 21:19:45 UTC 2026","passed","Sun Feb 15 21:19:46 UTC 2026","Feature flag management","admin/feature-flags.spec.ts","",""
"","417","should show filter controls","chromium","Sun Feb 15 21:10:45 UTC 2026","passed","Sun Feb 15 21:10:45 UTC 2026","Audit logs","admin/audit-logs.spec.ts","",""
"","1463","should add tier override and see it in table","chromium","Sun Feb 15 21:11:00 UTC 2026","passed","Sun Feb 15 21:11:01 UTC 2026","Feature flag overrides","admin/feature-flags-overrides.spec.ts","",""
"","353","should have Google button as type=button (not submit)","chromium","Sun Feb 15 21:11:18 UTC 2026","passed","Sun Feb 15 21:11:18 UTC 2026","Google OAuth","auth/google-oauth.spec.ts","",""
"","378","should stay on root URL (no locale prefix)","chromium","Sun Feb 15 21:11:39 UTC 2026","passed","Sun Feb 15 21:11:39 UTC 2026","Home page","smoke/home.spec.ts","",""
"","353","should display Google sign-in button on register page","chromium","Sun Feb 15 21:11:18 UTC 2026","passed","Sun Feb 15 21:11:18 UTC 2026","Google OAuth","auth/google-oauth.spec.ts","",""
"","2274","should not be able to login with old password after reset","mobile-chrome","Sun Feb 15 21:16:00 UTC 2026","passed","Sun Feb 15 21:16:02 UTC 2026","Password reset flow (E2E)","auth/password-reset-flow.spec.ts","",""
"","636","should display audit logs table","mobile-chrome","Sun Feb 15 21:11:41 UTC 2026","passed","Sun Feb 15 21:11:41 UTC 2026","Audit logs","admin/audit-logs.spec.ts","",""
"","377","should show forgot password link when no token","mobile-chrome","Sun Feb 15 21:16:14 UTC 2026","passed","Sun Feb 15 21:16:15 UTC 2026","Reset password page","auth/reset-password.spec.ts","",""
"","370","should display login form elements","chromium","Sun Feb 15 21:11:20 UTC 2026","passed","Sun Feb 15 21:11:20 UTC 2026","Login page","auth/login.spec.ts","",""
"","346","should display create flag form elements","mobile-chrome","Sun Feb 15 21:14:07 UTC 2026","passed","Sun Feb 15 21:14:07 UTC 2026","Feature flag management","admin/feature-flags.spec.ts","",""
